{
  "schemaVersion": "1.0",
  "actionClass": "S",
  "directTargets": ["requirements"],
  "impactedTargets": [
    {"id": "requirements", "action": "generate", "reasonPath": ["requirements"]}
  ],
  "conflicts": [
    {"lockedTarget": "solution", "blockedPath": ["requirements", "solution"], "code": "LOCKED_TARGET_CONFLICT"}
  ],
  "unaffectedTargets": ["solution", "workload"],
  "modelTaskCount": 1
}
